"Here are all the games coming in 2023 across PlayStation, Xbox, Switch, PC, and more."
"By 
    Gabe Gurwin
   on June 14, 2023 at 1:37PM PDT"
"2023 is shaping up to be an enormous year for video games, with many titles previously planned for this year getting pushed into next. Big-name games like Starfield are coming in 2023, as are several high-profile remakes of classic games."
"It can be a lot to keep track of, so we rounded up every game planned for release in 2023, splitting them into sections by month--as well as undated 2023 games--right here. Each game listing also shows supported platforms so you can figure out just what you're going to buy this year. As more games are announced and given release dates, this list will be further updated, and we'll also continue to adjust it if games are delayed."
"One Piece Odyssey (PS5, PS4, Xbox Series X|S, Xbox One, PC) - January 13"
"A Space for the Unbound (PS5, PS4, Xbox Series X|S, Xbox One, PC) - January 19"
"Colossal Cave (PS5, Xbox Series X|S, Switch, Quest, PC) - January 19"
"Persona 4 Golden (Switch, PC, PS4, Xbox Series X|S, Xbox One) - January 19"
"Persona 3 Portable (Switch, PC, PS4, Xbox Series X|S, Xbox One) - January 19"
Fire Emblem Engage (Switch) - January 20
"Forspoken (PS5, PC) - January 24"
NBA All-World (Mobile) - January 24
Warlander (PC) - January 24
"Hi-Fi Rush (Xbox Series X|S, PC) - January 25"
"Devolver Tumble Time (iOS, Android) - January 26"
"OddBallers (PS4, Xbox One, Switch, PC) - January 26"
"Shoulders of Giants (Xbox Series X|S, Xbox One) - January 26"
"Atone: Heart of the Elder Tree (PC, Switch) - January 27"
"Dead Space (PS5, Xbox Series X|S, PC) - January 27"
"GoldenEye 007 (Switch, Xbox Series X|S, Xbox One) - January 27"
"Backfirewall (PC, PS4, PS5, Xbox Series X|S, Xbox One) - January 30"
"Roboquest (Xbox Series X|S, Xbox One) - January 30"
"Age of Empires 2: Definitive Edition (Xbox Series X|S, Xbox One) - January 31"
"Inkulinati (PC, Xbox Series X|S, Xbox One) - January 31"
"Jett: The Far Shore + Given Time (PC, PS4, PS5) - January 31"
Undisputed (PC) - January 31
"Season: A letter to the future (PS5, PC) - January 31"
Superfuse (PC) - January 31
Avatar Generations (Mobile) - January 31
Valiant Hearts: Coming Home (Mobile) - January 31
"Albacete Warrior (Xbox Series X|S, Xbox One) - February 1"
"ReactorX2 (PC, Xbox Series X|S, Xbox One) - February 1"
"Rhythm Sprout (PS5, PS4, Xbox Series X|S, Xbox One, Switch, PC) - February 1"
"Deliver Us Mars (PC, PS4, PS5, Xbox One, Xbox Series X|S) - February 2"
"ExitMan Deluxe (Xbox Series X|S, Xbox One, Switch, PS4) - February 2"
"Fashion Police Squad (PS5, PS4, Xbox Series X|S, Xbox One, PC) - February 2"
"Heirs of the Kings (Xbox Series X|S, Xbox One, PC) - February 2"
Perish (PC) - February 2
"The Pathless (Xbox One, Xbox Series X|S, PC) - February 2"
"Speedway Racing (Xbox Series X|S, Xbox One) - February 3"
SpellForce: Conquest of Eo (PC) - February 3
Scorchlands (PC) - February 7
Metroid Prime Remastered (Switch) - February 8
"Clash: Artifacts of Chaos (PlayStation 5, Xbox Series X|S, PlayStation 4, Xbox One, PC) - February 9"
"Hogwarts Legacy (PlayStation 5, Xbox Series X|S, PC) - February 10"
"Wanted: Dead (PS5, PS4, Xbox Series X|S, Xbox One, PC) - February 10"
"Blanc (Switch, PC) - February 14"
"Souls of Chronos (PS5, Switch, PC) - February 14"
Tomb Raider Reloaded (Mobile) - February 14
"Cities: Skylines Console Remastered (PS5, Xbox Series X|S) - February 15"
Returnal (PC) - February 15
The Last Starship (PC early access) - February 15
"Elderand (Switch, PC) - February 16"
"Pinball FX (PS5, PS4, Xbox Series X|S, Xbox One, PC) - February 16"
"Theatrhythm Final Bar Line (Switch, PS4) - February 16"
"Tales of Symphonia Remastered (PS4, Xbox Series X|S, Xbox One, Switch) - February 17"
"The Settlers: New Allies (PS5, PS4, Xbox Series X|S, Xbox One, Switch, PC) - February 17"
"Wild Hearts (PS5, Xbox Series X|S, PC) - February 17"
"Akka Arrh (PS5, PS4, Xbox Series X|S, Switch, PC, Atari VCS) - February 21"
"Atomic Heart (PS5, PS4, Xbox Series X|S, Xbox One, PC) - February 21"
"Like a Dragon: Ishin (PS5, PS4, Xbox Series X|S, Xbox One, PC) - February 21"
"Seven Doors (PS5, PS4, Xbox Series X|S, Xbox One, Switch) - February 21"
Cosmonius High (PSVR 2) - February 22
"Digimon World: Next Order (Switch, PC) - February 22"
Horizon Call of the Mountain (PSVR 2) - February 22
"Redemption Reapers (PC, PS4, Switch) - February 22"
"Remoteness (PS5, PS4, Xbox Series X|S, Xbox One) - February 22"
"Blood Bowl 3 (PS5, PS4, Xbox Series X|S, Xbox One, PC) - February 23"
Company of Heroes 3 (PC) - February 23
Rumble Sus (Switch) - February 23
Sons of the Forest (PC) - February 23
Kerbal Space Program 2 (PC) - February 24
Kirby's Return to Dream Land Deluxe (Switch) - February 24
"Octopath Traveler 2 (Switch, PS5, PS4, PC) - February 24"
The Signifier VR (Quest 2) - February 24
"Scars Above (PS5, PS4, Xbox Series X|S, PC) - February 27"
"Catan: Console Edition (PS5, PS4, Xbox Series X|S, Xbox One) - February 28"
"Destiny 2: Lightfall (PS5, PS4, Xbox Series X|S, Xbox One, PC) - February 28"
"Rytmos (Switch, PC) - February 28"
Alephant (PC) - March 1
"Brok the Investigator (PS4, PS5, Xbox One, Switch) - March 1"
"Leap (PS5, PS4, Xbox Series X|S, Xbox One) - March 1"
"Mayhem in Single Valley (PS5, PS4, Xbox Series X|S, Xbox One, Switch) - March 2"
"No Longer Home (PS5, PS4) - March 3"
"Wo Long: Fallen Dynasty (PC, PS4, PS5, Xbox One, Xbox Series X|S) - March 3"
Pronty (Switch) - March 7
"The Outer Worlds: Spacer's Choice Edition (PS5, Xbox Series X|S, PC) - March 7"
"Caverns of Mars: Recharged (PS5, PS4, Xbox Series X|S, Xbox One, Switch, PC) - March 9"
"Fatal Frame: Mask of the Lunar Eclipse (PS5, PS4, Xbox Series X|S, Xbox One, Switch, PC) - March 9"
"Figment 2: Creed Valley (PS5, PS4, Xbox Series X|S, Xbox One, Switch, PC) - March 9"
"ONI: Road to be the Mightiest Oni (Switch, PS5, PS4, PC) - March 9"
"Peaky Blinders: The King's Ransom (Quest, PC VR) - March 9"
"The Last Spell (PS4, PS5, Switch, PC) - March 9"
Bleak Faith: Forsaken (PC) - March 10
"Rogue Spirit (PS5, Xbox Series X|S, PC) - March 14"
Spin Rhythm XD (PC) - March 14
"The Legend of Heroes: Trails to Azure (PS4, Switch, PC) - March 14"
"Valheim (Xbox Series X|S, Xbox One) - March 14"
"WWE 2K23 (PC, PS4, PS5, Xbox One, Xbox Series X|S) - March 14"
"Anno 1800 (PS5, Xbox Series X|S) - March 16"
"Post Void (PS4, Switch) - March 16"
Bayonetta Origins: Cereza and the Lost Demon (Switch) - March 17
"Peppa Pig: World Adventures (Xbox Series X|S, Xbox One, PS5, PS4, Switch, PC) - March 17"
"The Guise (Xbox Series X|S, Xbox One, PS5, PS4, Switch, PC) - March 17"
"Deceive, Inc. (Xbox Series X|S, PS5, PC) - March 21"
"Tchia (PS5, PS4, PC) - March 21"
Have a Nice Death (Switch) - March 22
"Omen of Sorrow (PS5, Switch, PC) - March 23"
"Storyteller (Switch, PC) - March 23"
"Atelier Ryza 3: Alchemist of the End & The Secret Key (Switch, PS4, PS5, PC) - March 24"
Deflector (PC) - March 24
"MLB The Show 23 (PS5, PS4, Xbox Series X|S, Xbox One, Switch) - March 24"
"Resident Evil 4 Remake (PS5, Xbox Series X|S, PC) - March 24"
9 Years of Shadows (PC) - March 27
Crime Boss: Rockay City (PC) - March 28
"Terra Nil (PC, Mobile) - March 28"
The Last of Us (PC) - March 28
"Forza Horizon 5: Rally Adventure DLC (Xbox Series X|S, Xbox One, PC) - March 29"
"Gripper (Switch, PC) - March 29"
"Dredge (PS4, PS5, Xbox One, Xbox Series X|S, Switch, PC) - March 30"
Ravenbound (PC) - March 30
"Saga of Sins (PS5, PS4, Xbox Series X|S, Switch, PC) - March 30"
The Great War: Western Front (PC) - March 30
Total Tank Generals (PC) - March 30
Troublemaker (PC) - March 31
"Atari Mania (PS4, PS5) - April 4"
Creed: Rise to Glory - Championship Edition (PSVR 2) - April 4
"GrimGrimoire OnceMore (PS5, PS4, Switch) - April 4"
"Meet Your Maker (PS5, PS4, Xbox Series X|S, Xbox One, PC) - April 4"
Moviehouse - The Film Studio Tycoon (PC) - April 5
"Curse of the Sea Rats (Switch, PS5, PS4, Xbox Series X|S, Xbox One, PC) - April 6"
Everspace 2 (PC) - April 6
"EA Sports PGA Tour 2023 (PS5, Xbox Series X|S, PC) - April 7"
"King of the Arcade (Xbox Series X|S, Xbox One) - April 12"
"Process of Elimination (PS4, Switch) - April 11"
Rendezvous (PC) - April 11
"Sherlock Holmes: The Awakened (PS5, PS4, Xbox Series X|S, Xbox One, PC) - April 11"
"Tron Identity (Switch, PC) - April 11"
Ghostwire: Tokyo (Xbox Series X|S) - April 12
"Murderous Muses (PS5, PS4, Xbox Series X|S, Xbox One, Switch, PC) - April 12"
Rusted Moss (PC) - April 12
WarTales (PC) - April 12
"Wildfrost (Switch, PC) - April 12"
Beyond the Long Flight (PC) - April 13
"Cannon Dancer - Osman (PS5, PS4, Xbox Series X|S, Xbox One, Switch) - April 13"
"Dogfight: A Sausage Bomber Story (PS4, Xbox Series X|S, Switch, PC) - April 13"
Hello Kitty and Friends: Happiness Parade (Switch) - April 13
Shardpunk: Verminfall (PC) - April 13
"Sokolor (Xbox Series X|S, Xbox One, Switch, PC) - April 13"
Voodolls (PC) - April 13
"Basketball Pinball (PS5, PS4, Xbox Series X|S, Xbox One, Switch, PC) - April 14"
"Farm Slider (Xbox Series X|S, Xbox One, Switch) - April 14"
"Mega Man Battle Network Legacy Collection (Switch, PS4, PC) - April 14"
"Disney Speedstorm (PC, PS5, PS4, Xbox Series X|S, Xbox One, Switch, all early access) - April 18"
"God of Rock (PC, Switch, PS5, PS4, Xbox Series X|S, Xbox One) - April 18"
"Minecraft Legends (Switch, PC, PS4, PS5, Xbox One, Xbox Series X|S) - April 18"
"Puzzle Quest 3 (Xbox Series X|S, Xbox One, PS5, PS4) - April 18"
"The Mageseeker: A League of Legends Story (PS5, PS4, Xbox Series X|S, Xbox One, Switch, PC) - April 18"
"Final Fantasy Pixel Remaster (PS4, Switch) - April 19"
Gun Jam (PC) - April 19
Shadows Over Loathing (Switch) - April 19
Survival: Fountain of Youth (PC early access) - April 19
"Teslagrad Remastered (PS5, PS4, Xbox Series X|S, Xbox One, PC, Switch) - April 19"
"Teslagrad 2 (PS5, PS4, Xbox Series X|S, Xbox One, PC, Switch) - April 19"
"Amid Evil VR (Quest, PC VR) - April 20"
"Coffee Talk Episode 2: Hibiscus and Butterfly (PS4, PS5, Xbox Series X|S, Xbox One, Switch, PC) - April 20"
Greedventory (PC) - April 20
Molly Medusa (Switch) - April 20
"Mr. Sun's Hatbox (Switch, PC) - April 20"
"Stray Blade (PC, PS5, Xbox Series X|S) - April 20"
Tin Hearts (Switch) - April 20
Advance Wars 1 + 2: Re-Boot Camp (Switch) - April 21
"Dead Island 2 (PS4, PS5, Xbox One, Xbox Series X|S, PC) - April 21"
"Homestead Arcana (Xbox Series X|S, PC) - April 21"
Transmogrify (PC) - April 24
"Fairy Fencer F: Refrain Chord (PS5, PS4, Switch) - April 25"
R-Type Final 3 Evolved (PS5) - April 25
"ArcRunner (PS4, PS5, Xbox One, Xbox Series X|S, PC) - April 27"
"Live a Live (PS5, PS4, PC) - April 27"
"Mail Time (PC, PS5, PS4, Switch) - April 27"
"Omega Strikers (PC, Xbox One, Xbox Series X|S, PS5, PS4, Switch, Mobile) - April 27"
"The Last Case of Benedict Fox (Xbox Series X|S, PC) - April 27"
"Tin Can (PS5, PS4, Xbox Series X|S, Xbox One) - April 27"
Unwording (PC) - April 27
"Star Wars Jedi: Survivor (PS5, Xbox Series X|S, PC) - April 28"
"Varney Lake (PS5, PS4, Xbox Series X|S, Xbox One, Switch, PC) - April 28"
Arto (PC) - May 1
City of Beats (PC) - May 1
Ethyrial: Echoes of Yore (PC) - May 1
Monster Tribe (PC) - May 1
RICE (PC) - May 1
The Witch of Fern Island (PC) - May 1
World Turtles (PC) - May 1
"Redfall (PC, Xbox Series X|S) - May 2"
Showgunners (PC) - May 2
"Bare Butt Boxing (PC, early access) - May 4"
"Propagation: Paradise Hotel (Quest, PC VR) - May 4"
"Ravenlok (Xbox Series X|S, Xbox One, PC) - May 4"
"Hogwarts Legacy (PS4, Xbox One) - May 5"
Darkest Dungeon II (PC) - May 8
Dokapon Kingdom: Connect (Switch) - May 9
Occupy Mars: The Game (PC early access) - May 10
The Legend of Zelda: Tears of the Kingdom (Switch) - May 12
"Humanity (PS5, PS4, PC) - May 16"
Firmament (PC) - May 18
SubwaySim Hamburg (PC) - May 17
The Outlast Trials (PC early access) - May 18
"Lego 2K Drive (Xbox Series X|S, Xbox One, PS5, PS4, Switch, PC) - May 19"
"Miasma Chronicles (PS5, Xbox Series X|S, PC) - May 23"
"Planet of Lana (Xbox Series X|S, Xbox One, PC) - May 23"
"Star Trek: Resurgence (PS5, PS4, Xbox Series X|S, Xbox One, PC) - May 23"
"Warhammer 40,000: Boltgun (Switch, PS4, PS5, Xbox Series X|S, Xbox One, PC) - May 23"
Daydream: Forgotten Sorrow (PC) - May 24
"Sunshine Shuffle (Switch, PC) - May 24"
Above Snakes (PC) - May 25
"Bat Boy (PS5, PS4, Xbox Series X|S, Xbox One, Switch, PC) - May 25"
"Evil Wizard (Xbox Series X|S, Xbox One, PC) - May 25"
Hello Neighbor: Search & Rescue (PSVR 2) - May 25
Tennis Manager 2023 (PC) - May 25
"The Lord of the Rings: Gollum (PS5, PS4, Xbox Series X|S, Xbox One, PC) - May 25"
Fitness Circuit (Switch) - May 26
"Shame Legacy (PS5, PS4, Xbox Series X|S, Xbox One, PC) - May 30"
System Shock (PC) - May 30
"Etrian Odyssey Origins Collection (Switch, PC) - June 1"
Slayers X (PC) - June 1
"Street Fighter 6 (PS5, PS4, Xbox Series X|S, PC) - June 2"
"Super Mega Baseball 4 (PS5, PS4, Xbox Series X|S, Xbox One, Switch, PC) - June 2"
"We Love Katamari Reroll+ Royale Reverie (PS5, PS4, Xbox Series X|S, Xbox One, Switch, PC) - June 2"
"Tiny Thor (Switch, PC) - June 5"
"Amnesia: The Bunker (PS4, Xbox Series X|S, Xbox One, PC) - June 6"
"Diablo IV (PS5, PS4, Xbox Series X|S, Xbox One, PC) - June 6"
"Bleak Sword DX (Switch, PC) - June 8"
Harmony: The Fall of Reverie (PC) - June 8
"Greyhill Incident (PS5, PS4, PC) - June 9"
"Layers of Fear (PS5, Xbox Series X|S, PC) - June 15"
Stack Island (PC) - June 16
"Aliens: Dark Descent (PS5, PS4, Xbox Series X|S, Xbox One, PC) - June 20"
"Crash Team Rumble (PS5, PS4, Xbox Series X|S, Xbox One) - June 20"
The Pegasus Expedition (PC) - June 20
Trepang2 (PC) - June 21
"Dr. Fetus' Mean Meat Machine (PS5, PS4, Xbox Series X|S, Xbox One, Switch, PC) - June 22"
Final Fantasy XVI (PS5) - June 22
"Forever Skies (PS5, PC, Xbox Series X|S) - June 22"
Nimbus Infinity (PC) - June 22
Silicon City (PC) - June 22
One Lonely Outpost (PC early access) - June 26
"Story of Seasons: A Wonderful Life (PS5, Xbox Series X|S, Switch, PC) - June 27"
Yomi 2 (PC) - June 27
SlavicPunk: Oldtimer (PC) - June 28
"Enclave HD (PS4, Xbox One, Switch) - June 29"
"Crime O'Clock (Switch, PC) - June 30"
Master Detective Archives: Rain Code (Switch) - June 30
Synapse (PSVR 2) - July 4
"GYLT (PS5, PS4, Xbox Series X|S, Xbox One, PC) - July 6"
"Oxenfree II: Lost Signals (PS5, PS4, Switch, PC) - July 12"
"Exoprimal (PS5, PS4, Xbox Series X|S, Xbox One, PC) - July 14"
"Ember Knights (Switch, PC) - July 18"
Turbo Overkill (PC) - July 18
My Friendly Neighborhood (PC) - July 18
"Immortals of Aveum (PS5, Xbox Series X|S, PC) - July 20"
"Nobunaga's Ambition: Awakening (PS4, Switch, PC) - July 20"
Pikmin 4 (Switch) - July 21
"Remnant 2 (PS5, Xbox Series X|S, PC) - July 25"
"Double Dragon Gaiden: Rise of the Dragon (PS5, PS4, Xbox Series X|S, Xbox One, Switch, PC) - July 27"
"The Expanse: A Telltale Series - Episode 1 (PS4, PS5, Xbox One, Xbox Series X|S, PC) - July 27"
Disney Illusion Island (Switch) - July 28
"Gord (Xbox Series X|S, PS5, PC) - August 8"
"WrestleQuest (PS5, PS4, Xbox Series X|S, Xbox One, Switch, PC) - August 8"
"30XX (Switch, PC) - August 9"
"Atlas Fallen (PS5, Xbox Series X|S, PC) - August 10"
"Stories of Blossom (Xbox Series X|S, Xbox One, PC) - August 16"
Book of Hours (PC) - August 17
"Bomb Rush Cyberfunk (Switch, PC) - August 18"
"Madden NFL 24 (PS5, PS4, Xbox Series X|S, Xbox One, PC) - August 18 (August 15 early access)"
"The Texas Chain Saw Massacre (PS5, PS4, Xbox Series X|S, Xbox One, PC) - August 18"
"Smurfs Kart (PS5, PS4, Xbox Series X|S, Xbox One) - August 22"
"Blasphemous 2 (Xbox Series X|S, PS5, Switch, PC) - August 24"
"Armored Core VI: Fires of Rubicon (PS5, PS4, Xbox Series X|S, Xbox One, PC) - August 25"
"Goodbye Volcano High (PS5, PS4, PC) - August 29"
"Rhapsody: Marl Kingdom Chronicles (PS5, Switch, PC) - August 29"
"Sea of Stars (PC, PS5, PS4, Xbox Series X|S, Xbox One, Switch) - August 29"
"Under the Waves (PS5, PS4, Xbox Series X|S, Xbox One, PC) - August 29"
"Daymare: 1994 Sandcastle (PS5, PS4, Xbox Series X|S, Xbox One, PC) - August 30"
"Baldur's Gate 3 (PS5, PC) - August 31"
"War Hospital (PS5, Xbox Series X|S, PC) - August 31"
"Chants of Sennaar (Switch, PC) - September 5"
"Rune Factory 3 Special (Switch, PC) - September 5"
"Starfield (PC, Xbox Series X|S) - September 6"
"Anonymous;Code (PC, Switch, PS4) - September 8"
Fae Farm (Switch) - September 8
"Super Bomberman R 2 (PC, PS5, PS4, Xbox Series X|S, Xbox One, Switch) - September 13"
"The Crew Motorfest (PS5, PS4, Xbox Series X|S, Xbox One, PC) - September 14"
"Lies of P (PC, PS4, PS5, Xbox One, Xbox Series X|S) - September 19"
"Mortal Kombat 1 (PS5, Xbox Series X|S, Switch, PC) - September 19 (September 15 early access)"
"Party Animals (Xbox Series X|S, Xbox One, PC) - September 20"
Witchfire (PC early access) - September 20
"Payday 3 (PS5, Xbox Series X|S, PC) - September 21"
"Cyberpunk 2077: Phantom Liberty expansion (PS5, Xbox Series X|S, PC) - September 26"
"Mineko's Night Market (Switch, PC) - September 26"
My Time at Sandrock (PC) - September 26
"Infinity Strash: Dragon Quest - The Adventures of Dai (PS5, PS4, Xbox Series X|S, PC) - September 28"
"Sword Art Online Last Recollection (PS5, PS4, Xbox Series X|S, Xbox One, PC) - October 6"
"Forza Motorsport (Xbox Series X|S, PC) - October 10"
"Assassin's Creed Mirage (PS5, PS4, Xbox Series X|S, Xbox One, PC) - October 12"
"Lords of the Fallen (PC, PS5, Xbox Series X|S) - October 13"
"Alan Wake 2 (PS5, Xbox Series X|S, PC) - October 17"
Cavern of Dreams (PC) - October 19
"Endless Dungeon (PS5, PS4, Xbox Series X|S, Switch, PC) - October 19"
"World of Horror (Switch, PS5, PS4, PC) - October 19"
Marvel's Spider-Man 2 (PS5) - October 20
"Cities: Skylines 2 (PS5, Xbox Series X|S, PC) - October 24"
"Alone in the Dark (PS5, Xbox Series X|S, PC) - October 25"
"Jumanji: Wild Adventures (PS5, PS4, Xbox Series X|S, Xbox One, Switch, PC) - November 3"
"The Day Before (PC, Xbox Series X|S, PS5) - November 10"
Hogwarts Legacy (Switch) - November 14
"Persona 5 Tactica (PS5, PS4, Xbox Series X|S, Xbox One, Switch, PC) - November 17"
"1000xResist (Switch, PC)"
Abiotic Factor (PC)
After the Fall (PSVR 2)`
"After Us (PS5, Xbox Series X|S, PC)"
Anger Foot (PC)
Arcadian Atlas (PC)
"Arc Raiders (PC, Xbox Series X|S, PS5)"
"Arizona Sunshine 2 (PSVR 2, PC VR)"
"Ark: Survival Ascended (PC, PS5, Xbox Series X|S)"
Arran: The Book of Heroes (PC)
Aska (PC)
Assassin's Creed Nexus (Quest 2)
"Banishers: Ghosts of New Eden (PS5, Xbox Series X|S, PC)"
Barkhan (PC)
Baten Kaitos 1 & 2 HD Remaster (Switch)
BattleBit Remastered (PC)
Behemoth (Quest 2)
Bio-Gun (PC)
"Black Myth: Wukong (PC, PS4, PS5, Xbox One, Xbox Series X|S)"
"Blasphemous 2 (Switch, PS5, Xbox Series X|S, PC)"
"Blazing Strike (PS5, PS4, Switch, PC)"
"Bomb Rush Cyberfunk (Switch, PC)"
Botany Manor (Switch)
"Boundary (PS4, PC)"
"Bounty Star (PS5, PS4, Xbox Series X|S, Xbox One, PC)"
Bramble: The Mountain King (PC)
Bulwark: Falconeer Chronicles (PC)
"Call of Duty: Warzone Mobile (iOS, Android)"
Capes (PC)
Cities VR - Enhanced Edition (PSVR 2)
"Cocoon (Xbox Series X|S, Xbox One, Switch, PC)"
Convergence: A League of Legends Story (PC)
Creature Keeper (PC)
Crossfire: Sierra Squad (PSVR 2)
"Cyber Knights: Flashpoint (PC, iOS, Android)"
"Cygni: All Guns Blazing (PS5, Xbox Series X|S, PC)"
Cygnus Enterprises (PC)
Daydream: Forgotten Sorrow (PC)
"Decapolice (PS5, PS4, Switch)"
"Desta: The Memories Between (Switch, PS4, Xbox One, PC)"
"Dordogne (Switch, PC, PS5, PS4, Xbox Series X|S, Xbox One, PC)"
Dune: Spice Wars (PC)
Dungeons of the Amber Griffin (PC)
Earth: From Another Sun (PC)
"Earthlock 2 (PS5, PS4, Xbox Series X|S, Xbox One, PC)"
"Ebenezer and the Invisible World (PS5, PS4, Xbox Series X|S, Xbox One, Switch, PC)"
"Eiyuden Chronicle: Hundred Heroes (Switch, PS4, PS5, Xbox Series X|S, Xbox One, PC)"
"Eternights (PS5, PS4, PC)"
"Everspace 2 (PS4, Xbox One, PC)"
Everywhere (Platforms TBA)
"F1 Manager 2023 (PS5, PS4, Xbox Series X|S, Xbox One, PC)"
Fashion Dreamer (Switch)
Final Fantasy VII Rebirth (PS5)
Five Nights at Freddy's: Help Wanted 2 (PSVR 2)
"Flashback 2 (PS5, PS4, Xbox Series X|S, Xbox One, Switch, PC)"
"Flintlock: The Siege of Dawn (PS5, PS4, Xbox Series X|S, Xbox One, PC)"
"Flock (PS5, PS4, Xbox Series X|S, Xbox One, PC)"
Front Mission 2 Remake (Switch)
Frozen Flame (PC)
"Ghostbusters: Rise of the Ghost Lord (Quest 2, PSVR 2)"
"Ghostrunner 2 (PS5, Xbox Series X|S, PC)"
Ghost Trick: Phantom Detective (Switch)
Glimmer in Mirror (PC)
"Gori: Cuddly Carnage (Switch, PS4, PS5, Xbox Series X|S, Xbox One, PC)"
"Gunbrella (Switch, PC)"
"Granblue Fantasy: Relink (PS5, PS4, PC)"
"Harmony: The Fall of Reverie (PS5, Xbox Series X|S, Switch, PC)"
"Helldivers 2 (PS5, PC)"
"Hell is Us (PS5, Xbox Series X|S, PC)"
"HellSweeper VR (PC VR, Quest 2)"
"Hercule Poirot: The London Case (PS5, PS4, Xbox Series X|S, Xbox One, Switch, PC)"
"Hyenas (PS5, PS4, Xbox Series X|S, Xbox One, PC)"
Hyper Light Breaker (PC)
Hytale (PC)
Ib (Switch)
"Inazuma Eleven: Victory Road of Heroes (PS4, Switch, iOS, Android)"
Industries of Titan (PC)
Inkbound (PC)
Jumplight Odyssey (PC)
"Jusant (PS5, Xbox Series X|S, PC)"
Jurassic World Aftermath Collection (PSVR 2)
Karlson (PC)
"KarmaZoo (PS5, Xbox Series X|S, Switch, PC)"
"Killer Klowns From Outer Space: The Game (PC, PS4, PS5, Xbox One, Xbox Series X|S)"
"Level Zero (PS5, PS4, Xbox Series X|S, Xbox One, PC)"
Lichenvale (PC)
Lifeless Moon (PC)
"Lightyear Frontier (Xbox Series X|S, Xbox One, PC)"
"Like a Dragon Gaiden: The Man Who Erased His Name (PS5, PS4, Xbox Series X|S, Xbox One, PC)"
"Lorelei and the Laser Eyes (Switch, PC)"
"Mask of the Rose (PS5, PS4, Xbox Series X|S, Xbox One, Switch, PC)"
Master Detective Archives: Rain Code (Switch)
Masterplan Tycoon (PC)
"Mega Man X Dive Offline (PC, iOS, Android)"
Men of War 2 (PC)
"Metal Slug Tactics (Switch, PC)"
Mina the Hollower (PC)
"Mineko's Night Market (Switch, PC)"
Moon Mystery (PC)
"Mortal Kombat: Onslaught (iOS, Android)"
"Moving Out 2 (PS5, PS4, Xbox Series X|S, Xbox One, Switch, PC)"
Mumbai Gullies (PC)
Nightingale (PC)
"Nine Sols (PC, Switch, PS4)"
"Off The Grid (PS5, Xbox Series X|S, PC)"
Once Human (PC)
"Ova Magica (Switch, PS4, PS5, Xbox Series X|S, Xbox One, PC)"
"Pacific Drive (PS5, PC)"
Palworld (PC)
"Paradize Project (PC, PS5, Xbox Series X|S)"
"Park Beyond (PS5, Xbox Series X|S, PC)"
"Party Animals (Xbox Series X|S, Xbox One, PC)"
"Pepper Grinder (Switch, PC)"
Pistol Whip (PSVR 2)
"PixelJunk Scrappers Deluxe (PS5, PS4)"
Prehistoric Kingdom (PC)
"Pragmata (PS5, Xbox Series X|S, PC)"
"Quilts and Cats of Calico (Switch, PC)"
"Raiden x Mikado Maniax (PS5, PS4, Xbox Series X|S, Xbox One, Switch)"
"Ravenswatch (PS5, PC)"
"Read Only Memories: Neurodiver (PS5, PS4, Xbox Series X|S, Xbox One, Switch, PC)"
"Remedium (PS5, PS4, Xbox Series X|S, Xbox One, Switch, PC)"
"Replaced (PC, Xbox One, Xbox Series X|S)"
"Rift of the NecroDancer (Switch, PC)"
"RoboCop: Rogue City (PC, Xbox Series X|S, PS5, Switch)"
"Romancelvania (PS4, PS5, Switch, PC)"
SacriFire (PC)
Sambe de Amigo: Party Central (Switch)
"Schim (PC, PS4, PS5)"
Shadows of Doubt (PC)
"Sherlock Holmes: The Awakened (Xbox Series X|S, Xbox One, PS5, PS4, Switch, PC)"
Silent Hill: Ascension (TBA)
Skate Story (PC)
"Song of Nunu: A League of Legends Story (PC, PS4, Xbox One, PS5, Xbox Series X|S, Switch)"
Songs of Conquest (PC)
Solium Infernum (PC)
"Sonic Superstars (PS5, PS4, Xbox Series X|S, Xbox One, Switch, PC)"
"Spongebob Squarepants: The Cosmic Shake (PS4, Xbox One, Switch, PC)"
"Stalker 2: Heart of Chornobyl (Xbox Series X|S, PC)"
"Star Wars: Hunters (Switch, iOS, Android)"
"SteamWorld Build (PC, consoles)"
Stellar Blade (PS5)
Stick it to the Stickman (PC)
"Suikoden 1 & II HD Remaster (PS5, Xbox One, Switch, PC)"
"Super Bomberman R 2 (Switch, PS4, PS5, Xbox Series X|S, Xbox One, PC)"
"System Shock (PS4, PS5, Xbox Series X|S, Xbox One, PC)"
"Tales of Symphonia (Switch, PS4, Xbox One)"
Tentacular (PSVR 2)
"Terra Nil (PC, iOS, Android)"
"Teslagrad 2 (PS5, PS4, Xbox Series X|S, Xbox One, Switch, PC)"
"Test Drive Unlimited: Solar Crown (Xbox Series X|S, Switch, PS5, PC)"
The Dark Pictures: Switchback VR (PSVR 2)
"The Invincible (PS5, Xbox Series X|S, PC)"
"The Isle Tide Hotel (PS5, PS4, Xbox Series X|S, Xbox One, Switch, iOS, Android, PC)"
"The Last Faith (PS5, PS4, Xbox Series X|S, Xbox One, Switch, PC)"
"The Legend of Heroes: Trails into Reverie (PS4, Switch, PC)"
The Light Brigade (PSVR 2)
"The Plucky Squire (PS5, Xbox Series X|S, Switch, PC)"
The Repair House (PC)
The Siege and the Sandfox (PC)
"The Sisters 2: Road to Fame (PS5, PS4, Xbox Series X|S, Xbox One, Switch, PC)"
"The Talos Principle 2 (PS5, Xbox Series X|S, PC)"
"The Walking Dead: Saints & Sinners - Chapter 2 (Quest, PSVR, PSVR 2)"
The Wandering Village (PC)
"The Wolf Among Us 2 (PC, PS4, PS5, Xbox One, Xbox Series X|S)"
"Thirsty Suitors (PS5, PS4, Xbox Series X|S, Xbox One, Switch, PC)"
"Time Flies (PS5, PS4, Switch, PC)"
"Tintin Reporter: Cigars of the Pharoah (Switch, PS4, PS5, Xbox Series X|S, Xbox One, PC)"
Total War: Pharaoh (PC)
"To The Stars (Switch, PC)"
Untamed Tactics (PC)
Venba (Switch)
"Vengeful Guardian: Moonrider (PS5, PS4, Switch, PC)"
"Warhammer 40,000: Darktide (Xbox Series X|S)"
"Warhammer 40,000: Rogue Trader (PC, consoles)"
"Warhammer 40,000: Space Marine 2 (Xbox Series X|S, PS5, PC)"
"Warhammer 40,000: Warpforge (PC)"
Warhaven (PC)
"Wild Hearts (PS5, Xbox Series X|S, PC)"
"WrestleQuest (Switch, PS5, PS4, Xbox Series X|S, Xbox One, PC)"
Xenonauts 2 (PC)
Ys IX: Monstrum Nox (PS5)
"Zenith: The Last City (Quest, PSVR)"
"
The products discussed here were independently chosen by our editors.
      GameSpot may get a share of the revenue if you buy anything featured on our site.
    
"
Got a news tip or want to contact us directly? Email news@gamespot.com
Use your keyboard!
Log in to comment
""
